<?xml version="1.0" encoding="UTF-8"?>
<!DOCTYPE credit SYSTEM "credits.dtd">

<Credits>
    <!-- Arcane -->
    <Credit>
        <Picture>
            <Titel>Arcane Logo</Titel>
            <Source>https://commons.wikimedia.org/wiki/File:Arcane_Title_Text.png</Source>
        </Picture>
    </Credit>
    <!-- Loki -->   
    <Credit>
        <Picture>
            <Titel>Loki Logo</Titel>
            <Source>https://commons.wikimedia.org/wiki/File:Loki_TV_Series_Logo_Black.svg</Source>
        </Picture>
    </Credit>
    <!-- WandaVision -->
    <Credit>
        <Picture>
            <Titel>WandaVision Logo</Titel>
            <Source>https://commons.wikimedia.org/wiki/File:WandaVision_wordmark_logo.svg</Source>
        </Picture>
    </Credit>
    <Credit>
        <Picture>
            <Titel>WandaVision Poster</Titel>
            <Source>https://images.app.goo.gl/wz8PS1tTy73bLLHJ7</Source>
        </Picture>
    </Credit>
    <!-- Falcon and WinterSoldier -->   
    <Credit>
        <Picture>
            <Titel>Loki Logo</Titel>
            <Source>https://upload.wikimedia.org/wikipedia/en/9/9a/The_Falcon_and_the_Winter_Soldier_logo.png</Source>
        </Picture>
    </Credit>
    
    <!-- TRAILERS -->
    <!-- Arcane Trailer -->
    <Credit>
        <Video>
            <Titel>Arcane | Final Trailer | Netflix</Titel>
            <Source>https://youtu.be/3Svs_hl897c</Source>
        </Video>
    </Credit>
    <!-- Loki Trailer -->
    <Credit>
        <Video>
            <Titel>Marvel Studios' Loki | Official Trailer | Disney+</Titel>
            <Source>https://youtu.be/nW948Va-l10</Source>
        </Video>
    </Credit>
    <!-- WandaVision Trailer -->
    <Credit>
        <Video>
            <Titel>WandaVision | Official Trailer | Disney+</Titel>
            <Source>https://youtu.be/sj9J2ecsSpo</Source>
        </Video>
    </Credit>
    <!-- Falcon and WinterSoldier Trailer -->
    <Credit>
        <Video>
            <Titel>Official Trailer | The Falcon and the Winter Soldier | Disney+</Titel>
            <Source>https://youtu.be/IWBsDaFWyTE</Source>
        </Video>
    </Credit>
</Credits>